{
  "schema_version": 1,
  "id": "COST-L-0003",
  "title": "ioctl structure layouts that vary across caller ABIs",
  "status": "CANDIDATE",
  "category": "IOCTL",
  "subsystem": "device userspace ABI",
  "summary": "Source-backed research candidate for a recurring semantic dependency. No active KOLVRT consumer, compatibility implementation or measured cost is claimed.",
  "research_date": "2026-10-03",
  "introduced_at": "2026-10-02",
  "last_observed_at": null,
  "history": {
    "linux_behavior": "Some ioctl arguments vary in pointer width, integer width or alignment between caller ABIs and require compatibility conversion; changing published commands can break applications.",
    "historical_reason": "Extensible device commands preserve existing application contracts across architecture and interface evolution.",
    "root_cause": "Published layouts couple request interpretation to caller ABI; untyped command transport alone cannot establish typed native authority.",
    "classification": "COMPATIBILITY_REQUIREMENT",
    "linux_versions": ["v6.12"],
    "first_known_version": null,
    "unknown_origin_reason": "The pinned documentation establishes the described behavior, not its first introducing release/commit. Historical origin requires separate investigation."
  },
  "sources": [
    {
      "id": "S1",
      "title": "Linux v6.12: driver-api/ioctl.rst",
      "url": "https://github.com/torvalds/linux/blob/adc218676eef25575469234709c2d87185ca223a/Documentation/driver-api/ioctl.rst",
      "kind": "OFFICIAL_DOCUMENTATION",
      "commit": "adc218676eef25575469234709c2d87185ca223a",
      "version": "v6.12",
      "locator": "Interface versions; 32-bit compat mode; Structure layout",
      "date": null,
      "limitations": "Pinned documentation reviewed; original introduction/publication date, representative driver users and historical causality remain unverified."
    }
  ],
  "evidence": {
    "linux_behavior": ["S1"],
    "historical_reason": ["S1"],
    "root_cause": ["S1"]
  },
  "native": {
    "status": "PROPOSED",
    "behavior": "Native messages declare widths, bounds, versions and initialization; new capability types require demonstrated authority differences. No generic native ioctl escape hatch is admitted.",
    "why_differs": "A compatibility decoder must identify the exact command/layout and call a narrow native operation without passing arbitrary opcodes or issuing extra authority.",
    "references": [
      "docs/architecture/native-model.md",
      "docs/architecture/kernel-laws.md"
    ]
  },
  "compat_modules": [],
  "affected_consumers": [],
  "affected_driver_families": [],
  "runtime_cost": {
    "cpu": {
      "state": "UNKNOWN",
      "value": null,
      "unit": "ns",
      "scope": "Research-only candidate; no implemented adapter or executed Linux driver.",
      "denominator": null,
      "coverage": "UNKNOWN",
      "provenance": null,
      "reason": "No comparable implemented workload or runtime observation exists."
    },
    "latency": {
      "state": "UNKNOWN",
      "value": null,
      "unit": "ns",
      "scope": "Research-only candidate; no implemented adapter or executed Linux driver.",
      "denominator": null,
      "coverage": "UNKNOWN",
      "provenance": null,
      "reason": "No comparable implemented workload or runtime observation exists."
    },
    "memory": {
      "state": "UNKNOWN",
      "value": null,
      "unit": "bytes",
      "scope": "Research-only candidate; no implemented adapter or executed Linux driver.",
      "denominator": null,
      "coverage": "UNKNOWN",
      "provenance": null,
      "reason": "No comparable implemented workload or runtime observation exists."
    },
    "copies": {
      "state": "UNKNOWN",
      "value": null,
      "unit": "count",
      "scope": "Research-only candidate; no implemented adapter or executed Linux driver.",
      "denominator": null,
      "coverage": "UNKNOWN",
      "provenance": null,
      "reason": "No comparable implemented workload or runtime observation exists."
    },
    "allocations": {
      "state": "UNKNOWN",
      "value": null,
      "unit": "count",
      "scope": "Research-only candidate; no implemented adapter or executed Linux driver.",
      "denominator": null,
      "coverage": "UNKNOWN",
      "provenance": null,
      "reason": "No comparable implemented workload or runtime observation exists."
    },
    "context_switches": {
      "state": "UNKNOWN",
      "value": null,
      "unit": "count",
      "scope": "Research-only candidate; no implemented adapter or executed Linux driver.",
      "denominator": null,
      "coverage": "UNKNOWN",
      "provenance": null,
      "reason": "No comparable implemented workload or runtime observation exists."
    },
    "throughput": {
      "state": "UNKNOWN",
      "value": null,
      "unit": "operations/s",
      "scope": "Research-only candidate; no implemented adapter or executed Linux driver.",
      "denominator": null,
      "coverage": "UNKNOWN",
      "provenance": null,
      "reason": "No comparable implemented workload or runtime observation exists."
    }
  },
  "security_impact": "Validate the same owned snapshot used for execution; distinguish scalars from pointers and preserve native caller/effect scope.",
  "authority_implications": "NO_AUTHORITY_EXPANSION",
  "complexity_impact": "Each actual ABI pair needs layout tests; command count is neither capability count nor driver coverage.",
  "support": {
    "status": "RESEARCH_ONLY",
    "owner": null,
    "owner_unknown_reason": "No supported implementation/consumer owner has been assigned.",
    "start": null,
    "until": null,
    "migration_target": "Migrate named consumers to explicit versioned native operations; support only reviewed command/layout pairs while obligations remain.",
    "migration_strategy": "Identify named consumers and the accepted native contract before proposing compatibility; native rewrite or deferral remain options.",
    "removal_condition": "No implementation currently exists. Any future implementation needs finite support, named consumers including offline/archival paths and proven quiescence; retain this historical record even if the candidate is rejected."
  },
  "lifecycle": [
    {
      "status": "CANDIDATE",
      "date": "2026-10-02",
      "decision": "Assign stable research identity after reviewing pinned semantic evidence; support/incompatibility confirmation remains open."
    }
  ],
  "related_cost_l": [],
  "source_cases": [],
  "exceptions": [],
  "tests": [],
  "benchmarks": [],
  "confidence": "LOW",
  "proverb_ru": "Что в ioctl вошло — то из ABI уже не вышло.",
  "open_questions": [
    "Which named driver command and caller ABI require layout translation on the supported target?",
    "Does any proposed command require a genuinely new native authority model?",
    "What is the first introducing release/commit?",
    "Who owns any future supported implementation and finite migration window?"
  ]
}
